
SQL*Plus: Release 11.2.0.2.0 Production on Wed Jan 30 09:26:01 2019

Copyright (c) 1982, 2014, Oracle.  All rights reserved.

SQL> connect Trg428/training428@//10.219.34.3:1521/orcl
Connected.
SQL> create table exstud(rno number constraint rno_pk primary key,name arrchsr2(20);
create table exstud(rno number constraint rno_pk primary key,name arrchsr2(20)
                                                                          *
ERROR at line 1:
ORA-00907: missing right parenthesis


SQL> create table exstud(rno number constraint rno_pk primary key,name varchar2(20));

Table created.

SQL> desc exstud;
 Name                                      Null?    Type
 ----------------------------------------- -------- ----------------------------
 RNO                                       NOT NULL NUMBER
 NAME                                               VARCHAR2(20)

SQL> select table_name,constarint_name from user_constarints where table_name='EXSTUD';
select table_name,constarint_name from user_constarints where table_name='EXSTUD'
                                       *
ERROR at line 1:
ORA-00942: table or view does not exist


SQL> select table_name,constarint_name ,constraint_name,constraint_type from user_constarints where table_name='EXSTUD';
select table_name,constarint_name ,constraint_name,constraint_type from user_constarints where table_name='EXSTUD'
                                                                        *
ERROR at line 1:
ORA-00942: table or view does not exist


SQL> select table_name,constarint_name from user_constarints where table_name='Exstud';
select table_name,constarint_name from user_constarints where table_name='Exstud'
                                       *
ERROR at line 1:
ORA-00942: table or view does not exist


SQL> select table_name,constarint_name from user_constarints where table_name='exstud';
select table_name,constarint_name from user_constarints where table_name='exstud'
                                       *
ERROR at line 1:
ORA-00942: table or view does not exist


SQL> create table exstud123(rno number constraint rno_pk1 primary key,name varchar2(20) constraint name_nn123 not null, hire_date date not null,sal number constraint sal_chk13 check(sasl>0), email varchar2(20) unique);
create table exstud123(rno number constraint rno_pk1 primary key,name varchar2(20) constraint name_nn123 not null, hire_date date not null,sal number constraint sal_chk13 check(sasl>0), email varchar2(20) unique)
                                                                                                                                                                                        *
ERROR at line 1:
ORA-02438: Column check constraint cannot reference other columns


SQL> create table exstud123(rno number constraint rno_pk1 primary key,name varchar2(20) constraint name_nn123 not null, hire_date date not null,sal number constraint sal_chk13 check(sal>0), email varchar2(20) unique);

Table created.

SQL> select table_name,constraint_name,constraint_type from user_constraint where table_name='EXSTUD123';
select table_name,constraint_name,constraint_type from user_constraint where table_name='EXSTUD123'
                                                       *
ERROR at line 1:
ORA-00942: table or view does not exist


SQL> select table_name,constraint_name,constraint_type from user_constraints where table_name='EXSTUD123';

TABLE_NAME                     CONSTRAINT_NAME                C
------------------------------ ------------------------------ -
EXSTUD123                      NAME_NN123                     C
EXSTUD123                      SYS_C00578322                  C
EXSTUD123                      SAL_CHK13                      C
EXSTUD123                      RNO_PK1                        P
EXSTUD123                      SYS_C00578325                  U

SQL> create table dept123(dno number primary key,name vaechar2(20),loc varchar2(20)
  2
SQL> create table dept123(dno number primary key,name varchar2(20),loc varchar2(20));

Table created.

SQL> drop exstud123;
drop exstud123
     *
ERROR at line 1:
ORA-00950: invalid DROP option


SQL> select table_name,constraint_name,constraint_type from user_constraints where table_name='EXSTUD123';

TABLE_NAME                     CONSTRAINT_NAME                C
------------------------------ ------------------------------ -
EXSTUD123                      NAME_NN123                     C
EXSTUD123                      SYS_C00578322                  C
EXSTUD123                      SAL_CHK13                      C
EXSTUD123                      RNO_PK1                        P
EXSTUD123                      SYS_C00578325                  U

SQL> drop exstud123
  2  drop exstud123;
drop exstud123
     *
ERROR at line 1:
ORA-00950: invalid DROP option


SQL> drop exstud123;
drop exstud123
     *
ERROR at line 1:
ORA-00950: invalid DROP option


SQL> drop table exstud123;

Table dropped.

SQL> select table_name,constraint_name,constraint_type from user_constraints where table_name='EXSTUD123';

no rows selected

SQL> create table exstud123(rno number constraint rno_pk1 primary key,name varchar2(20) constraint name_nn123 not null, hire_date date not null,sal number constraint sal_chk13 check(sal>0), email varchar2(20) unique,deptno number constraint deptno_FK123 references dept123(dno));

Table created.

SQL> select * from dept123;

no rows selected

SQL> insert into exstud123 values(102,'vimal',sysdate,13000,'abc@gmail.com',20);
insert into exstud123 values(102,'vimal',sysdate,13000,'abc@gmail.com',20)
*
ERROR at line 1:
ORA-02291: integrity constraint (TRG428.DEPTNO_FK123) violated - parent key not
found


SQL> desc exstud123;
 Name                                      Null?    Type
 ----------------------------------------- -------- ----------------------------
 RNO                                       NOT NULL NUMBER
 NAME                                      NOT NULL VARCHAR2(20)
 HIRE_DATE                                 NOT NULL DATE
 SAL                                                NUMBER
 EMAIL                                              VARCHAR2(20)
 DEPTNO                                             NUMBER

SQL> insert into exstud123 values(102,'vimal',sysdate,13000,'abc@gmail.com',20);
insert into exstud123 values(102,'vimal',sysdate,13000,'abc@gmail.com',20)
*
ERROR at line 1:
ORA-02291: integrity constraint (TRG428.DEPTNO_FK123) violated - parent key not
found


SQL> insert into dept123 values(10,'Arun','Chennai');

1 row created.

SQL> insert into exstud123 values(102,'vimal',sysdate,13000,'abc@gmail.com',20);
insert into exstud123 values(102,'vimal',sysdate,13000,'abc@gmail.com',20)
*
ERROR at line 1:
ORA-02291: integrity constraint (TRG428.DEPTNO_FK123) violated - parent key not
found


SQL> select * from dept123;

       DNO NAME                 LOC
---------- -------------------- --------------------
        10 Arun                 Chennai

SQL> insert into exstud123 values(102,'Kumar',sysdate,13000,'abc@gmail.com',20);
insert into exstud123 values(102,'Kumar',sysdate,13000,'abc@gmail.com',20)
*
ERROR at line 1:
ORA-02291: integrity constraint (TRG428.DEPTNO_FK123) violated - parent key not
found


SQL> insert into exstud123 values(102,'Kumar',sysdate,13000,'abc@gmail.com',10);

1 row created.

SQL> select * from exstud123;

       RNO NAME                 HIRE_DATE        SAL EMAIL
---------- -------------------- --------- ---------- --------------------
    DEPTNO
----------
       102 Kumar                30-JAN-19      13000 abc@gmail.com
        10


SQL> insert into dept123 values(20,'Raj,'Coimbatore');
ERROR:
ORA-01756: quoted string not properly terminated


SQL> insert into dept123 values(20,'Raj','Coimbatore');

1 row created.

SQL> insert into exstud123 values(103,'Ramu',sysdate,35000,'xyz@gmail.com',20);

1 row created.

SQL> select * from exstud123;

       RNO NAME                 HIRE_DATE        SAL EMAIL
---------- -------------------- --------- ---------- --------------------
    DEPTNO
----------
       102 Kumar                30-JAN-19      13000 abc@gmail.com
        10

       103 Ramu                 30-JAN-19      35000 xyz@gmail.com
        20


SQL> delete from dept123 where deptno=10;
delete from dept123 where deptno=10
                          *
ERROR at line 1:
ORA-00904: "DEPTNO": invalid identifier


SQL> delete from dept123 where dno=10;
delete from dept123 where dno=10
*
ERROR at line 1:
ORA-02292: integrity constraint (TRG428.DEPTNO_FK123) violated - child record
found


SQL> commit;

Commit complete.

SQL> drop table exstud123;

Table dropped.

SQL> commit;

Commit complete.

SQL> create table exstud123(rno number constraint rno_pk1 primary key,name varchar2(20) constraint name_nn123 not null, hire_date date not null,sal number constraint sal_chk13 check(sal>0), email varchar2(20) unique,deptno number constraint deptno_FK123 references dept123(dno) on delete cascade);

Table created.

SQL> delete from dept123 where dno=10;

1 row deleted.

SQL> select * from dept123;

       DNO NAME                 LOC
---------- -------------------- --------------------
        20 Raj                  Coimbatore

SQL> select * from exstud123;

no rows selected

SQL> create table sampletest(tno number,tname varchar2(20));

Table created.

SQL> alter table sampletest add deptno;
alter table sampletest add deptno
                           *
ERROR at line 1:
ORA-02263: need to specify the datatype for this column


SQL> alter table sampletest add deptno number;

Table altered.

SQL> desc sampletest;
 Name                                      Null?    Type
 ----------------------------------------- -------- ----------------------------
 TNO                                                NUMBER
 TNAME                                              VARCHAR2(20)
 DEPTNO                                             NUMBER

SQL> alter table sampletest drop deptno;
alter table sampletest drop deptno
                            *
ERROR at line 1:
ORA-00905: missing keyword


SQL> alter table sampletest drop deptno number;
alter table sampletest drop deptno number
                            *
ERROR at line 1:
ORA-00905: missing keyword


SQL> alter table sampletest drop column deptno;

Table altered.

SQL> desc sampletest;
 Name                                      Null?    Type
 ----------------------------------------- -------- ----------------------------
 TNO                                                NUMBER
 TNAME                                              VARCHAR2(20)

SQL> alter table sampletest add deptno number;

Table altered.

SQL> alter table sampletest modify deptno varchar2(20);

Table altered.

SQL> desc sampletest;
 Name                                      Null?    Type
 ----------------------------------------- -------- ----------------------------
 TNO                                                NUMBER
 TNAME                                              VARCHAR2(20)
 DEPTNO                                             VARCHAR2(20)

SQL> alter table sampletest set unused column deptno ;

Table altered.

SQL> desc sampletest;
 Name                                      Null?    Type
 ----------------------------------------- -------- ----------------------------
 TNO                                                NUMBER
 TNAME                                              VARCHAR2(20)

SQL> alter table sampletest drop unused column ;

Table altered.

SQL> alter table sampletest add constraint deptno_pk primary key(deptno);
alter table sampletest add constraint deptno_pk primary key(deptno)
                                                            *
ERROR at line 1:
ORA-00904: "DEPTNO": invalid identifier


SQL> alter table sampletest add constraint deptno_pk primary key(dept);
alter table sampletest add constraint deptno_pk primary key(dept)
                                                            *
ERROR at line 1:
ORA-00904: "DEPT": invalid identifier


SQL> alter table sampletest add deptno number;

Table altered.

SQL> alter table sampletest add constraint deptno_pk primary key(deptno);

Table altered.

SQL> desc sampletest;
 Name                                      Null?    Type
 ----------------------------------------- -------- ----------------------------
 TNO                                                NUMBER
 TNAME                                              VARCHAR2(20)
 DEPTNO                                    NOT NULL NUMBER

SQL> alter table sampletest disable constraint deptno_pk;

Table altered.

SQL> desc sampletest;
 Name                                      Null?    Type
 ----------------------------------------- -------- ----------------------------
 TNO                                                NUMBER
 TNAME                                              VARCHAR2(20)
 DEPTNO                                             NUMBER

SQL> insert into sampletest values(100,'A',10);

1 row created.

SQL> insert into sampletest values(100,'A',10);

1 row created.

SQL> desc sampletest;
 Name                                      Null?    Type
 ----------------------------------------- -------- ----------------------------
 TNO                                                NUMBER
 TNAME                                              VARCHAR2(20)
 DEPTNO                                             NUMBER

SQL> desc deptno;
ERROR:
ORA-04043: object deptno does not exist


SQL> select * from sampletest;

       TNO TNAME                    DEPTNO
---------- -------------------- ----------
       100 A                            10
       100 A                            10

SQL> rename sampletest to sample;

Table renamed.

SQL> desc sample;
 Name                                      Null?    Type
 ----------------------------------------- -------- ----------------------------
 TNO                                                NUMBER
 TNAME                                              VARCHAR2(20)
 DEPTNO                                             NUMBER

SQL> rename sample to sampletest;

Table renamed.

SQL> desc sampletest;
 Name                                      Null?    Type
 ----------------------------------------- -------- ----------------------------
 TNO                                                NUMBER
 TNAME                                              VARCHAR2(20)
 DEPTNO                                             NUMBER

SQL> create sequence s1
  2  start with 10
  3  increment by 1
  4  maxvalue 50;

Sequence created.

SQL> truncate table sampletest;

Table truncated.

SQL> desc sampletest;
 Name                                      Null?    Type
 ----------------------------------------- -------- ----------------------------
 TNO                                                NUMBER
 TNAME                                              VARCHAR2(20)
 DEPTNO                                             NUMBER

SQL> insert into sampletest values(s1_1.nextval,'A',10);
insert into sampletest values(s1_1.nextval,'A',10)
                              *
ERROR at line 1:
ORA-02289: sequence does not exist


SQL> insert into sampletest values(s1_1.nextval,'A',20);
insert into sampletest values(s1_1.nextval,'A',20)
                              *
ERROR at line 1:
ORA-02289: sequence does not exist


SQL> select * from sampletest;

no rows selected

SQL> insert into sampletest values(s1,'A',20);
insert into sampletest values(s1,'A',20)
                              *
ERROR at line 1:
ORA-00984: column not allowed here


SQL> insert into sampletest values(s1,'A',20);
insert into sampletest values(s1,'A',20)
                              *
ERROR at line 1:
ORA-00984: column not allowed here


SQL> create index ind123 on sampletest(tno);

Index created.

SQL> select index_name,table_name from user_indexes where index_name='IND123';

INDEX_NAME                     TABLE_NAME
------------------------------ ------------------------------
IND123                         SAMPLETEST

SQL> insert into sampletest values(s1_1.nextval,'A',20);
insert into sampletest values(s1_1.nextval,'A',20)
                              *
ERROR at line 1:
ORA-02289: sequence does not exist


SQL> insert into sampletest values(s1.nextval,'A',20);

1 row created.

SQL> desc sampletest;
 Name                                      Null?    Type
 ----------------------------------------- -------- ----------------------------
 TNO                                                NUMBER
 TNAME                                              VARCHAR2(20)
 DEPTNO                                             NUMBER

SQL> select index_name,table from user_indexes where index_name='IND123';
select index_name,table from user_indexes where index_name='IND123'
                  *
ERROR at line 1:
ORA-00936: missing expression


SQL> select index_name,table_name from user_indexes where index_name='IND123';

INDEX_NAME                     TABLE_NAME
------------------------------ ------------------------------
IND123                         SAMPLETEST

SQL> insert into sampletest values(s1,'B',21);
insert into sampletest values(s1,'B',21)
                              *
ERROR at line 1:
ORA-00984: column not allowed here


SQL> insert into sampletest values(s1,'B',30);
insert into sampletest values(s1,'B',30)
                              *
ERROR at line 1:
ORA-00984: column not allowed here


SQL> desc sampletest;
 Name                                      Null?    Type
 ----------------------------------------- -------- ----------------------------
 TNO                                                NUMBER
 TNAME                                              VARCHAR2(20)
 DEPTNO                                             NUMBER

SQL> select deptno from sampletest;

    DEPTNO
----------
        20

SQL> create unique index index_name on table_name(tno,deptno,tname);
create unique index index_name on table_name(tno,deptno,tname)
                                  *
ERROR at line 1:
ORA-00942: table or view does not exist


SQL> create unique index index_name on sampletest(tname);

Index created.

SQL>